Name of Covered Entity,State,Covered Entity Type,Individuals Affected,Breach Submission Date,Type of Breach,Location of Breached Information,Business Associate Present,Web Description
King County Public Hospital District No. 2 d/b/a EvergreenHealth,WA,Healthcare Provider,20533,04/22/2022,Hacking/IT Incident,Network Server,Yes,NA
Serendipity Hearing Inc.,CA,Healthcare Provider,3100,05/06/2021,Theft,Desktop Computer,No,"The covered entity (CE), Serendipity Hearing, reported that multiple computers and hard drives that contained the electronic protected health information (ePHI) of 3,100 individuals, were stolen from its office during a burglary.  The ePHI involved included names, addresses, dates of birth, health insurance information, and lab results.  The CE notified HHS, affected individuals, the media, and posted substitute notice on its website. The CE also provided complimentary credit monitoring services and a phone number for questions or concerns.  In response to the breach, the CE implemented additional physical and technical safeguards to better protected its ePHI.  OCR provided technical assistance to the CE."
Precision Spine Care,TX,Healthcare Provider,20787,01/12/2021,Hacking/IT Incident,Email,No,"The covered entity (CE), Precision Spine Care, reported that an employee was the victim of an email phishing attack that affected the electronic protected health information (ePHI) of 20,787 individuals.  The ePHI involved included names, dates of birth, Social Security numbers, addresses, phone numbers, diagnoses, medications prescribed, and other treatment information.  The CE notified HHS, affected individuals, the media, and provided substitute notice on its website.  In response to the breach, the CE implemented additional technical safeguards and retrained its employees on email security."
Pristine Dental,MA,Healthcare Provider,1428,11/05/2020,Hacking/IT Incident,Network Server,No,"The covered entity (CE), Pristine Dental, reported that it was the victim of a ransomware attack that affected the electronic protected health information (ePHI) of 1,428 individuals. The ePHI involved included names, dates of birth, addresses, drivers’ license numbers, Social Security numbers, diagnoses/conditions, and other treatment information. The CE notified HHS, affected individuals, the media, the FBI, and provided complimentary identity monitoring services. In response to the breach, the CE implemented additional administrative and technical safeguards to better protect its ePHI."
"Communities Connected for Kids, Inc.",FL,Business Associate,192041,05/15/2019,Hacking/IT Incident,Network Server,Yes,"The business associate (BA), Communities Connected for Kids, Inc., reported that its vendor experienced a cyber-attack that affected the electronic protected health information (ePHI) of 192,041 individuals. The ePHI involved included names, addresses, dates of birth, drivers’ license numbers, Social Security numbers, diagnoses/conditions, lab results, medications prescribed, and other treatment information. The BA notified HHS, affected individuals, the media, and posted substitute notice to its website. The BA also provided affected individuals with complimentary credit monitoring services. In response to the breach, the BA updated its risk management plan and implemented additional technical safeguards. OCR provided the BA with technical assistance pertaining to the HIPAA Security Rule."
